{
  "schema_version": 1,
  "key": "peanut.reference-codes",
  "name": "Peanut Reference Codes",
  "description": "Reusable Tenant-owned versioned reference-code infrastructure for Peanut Admin Modules",
  "version": "0.1.0",
  "kernel_constraint": "^1.0",
  "license": "Apache-2.0",
  "php_package": "peanut-admin/core",
  "web_package": "@peanut-admin/admin/reference-codes",
  "dependencies": [],
  "backend": {
    "provider": "PeanutAdmin\\App\\modules\\peanut\\reference_codes\\ModuleProvider",
    "migrations": "database/migrations",
    "menus": "resources/menus.json",
    "permissions": "resources/permissions.json",
    "protected_resources": "resources/protected-resources.json",
    "reference_code_sets": "resources/reference-code-sets.json"
  },
  "frontend": {
    "entry": "frontend/src/modules/peanut-reference-codes/index.ts",
    "routes": "frontend/src/modules/peanut-reference-codes/routes.ts"
  },
  "database": {
    "owned_tables": [
      "pa_reference_code_set",
      "pa_reference_code_entry",
      "pa_reference_code_entry_version"
    ]
  },
  "contracts": {
    "exports": [],
    "events": []
  },
  "tenant": {
    "enableable": true,
    "disable_behavior": "reject_new_operations",
    "requires": []
  }
}
