{
  "schema_version": 1,
  "key": "example.target",
  "name": "Example Target",
  "description": "Fictional typed target provider for Peanut Admin contract validation",
  "version": "1.0.0",
  "kernel_constraint": "^1.0",
  "license": "Apache-2.0",
  "php_package": null,
  "web_package": null,
  "dependencies": [],
  "backend": {
    "provider": "PeanutAdmin\\App\\modules\\example\\target\\ModuleProvider",
    "migrations": "database/migrations",
    "menus": "resources/menus.json",
    "permissions": "resources/permissions.json",
    "protected_resources": "resources/protected-resources.json",
    "setting_definitions": "resources/setting-definitions.json",
    "target_types": "resources/target-types.json"
  },
  "frontend": {
    "entry": "frontend/src/modules/example-target/index.ts",
    "routes": "frontend/src/modules/example-target/routes.ts",
    "locales": "frontend/src/modules/example-target/locales"
  },
  "database": {
    "owned_tables": ["pa_example_project", "pa_example_queue"]
  },
  "contracts": {
    "exports": [
      "PeanutAdmin\\App\\modules\\example\\target\\contracts\\TargetQuery",
      "PeanutAdmin\\App\\modules\\example\\target\\contracts\\TargetIdSet",
      "PeanutAdmin\\App\\modules\\example\\target\\contracts\\TargetRuntimeProvider"
    ],
    "events": []
  },
  "tenant": {
    "enableable": true,
    "disable_behavior": "reject_new_operations",
    "requires": []
  }
}
